{
  "$schema": "./versions.schema.json",
  "schemaVersion": 1,
  "repository": {
    "slug": "unionofblackbean/BetterShulkerHUDMod",
    "defaultBranch": "master",
    "releaseArtifactPrefix": "BetterShulkerHud"
  },
  "legacyRoot": {
    "minecraft": "26.1.2",
    "modVersion": "1.8.8",
    "status": "historical-source-only",
    "includedInCi": false,
    "plannedPath": "legacy/26.1.2-1.8.8"
  },
  "versions": [
    {
      "id": "26.1.1",
      "path": "versions/26.1.1",
      "minecraft": { "build": "26.1.1", "range": "26.1.1" },
      "modVersion": "2.2.3",
      "java": 25,
      "gradle": "9.5.1",
      "loom": "1.16.3",
      "loader": { "build": "0.19.2", "requirement": ">=0.19.2" },
      "fabricApi": "0.145.4+26.1.1",
      "malilib": "fi.dy.masa.malilib:malilib-fabric-26.1.1:0.28.2",
      "optionalCompatibility": {
        "quickShulker": "3.0.1-26.1",
        "rei": "26.1.819",
        "jei": "29.4.0.23",
        "itemScroller": "0.31.0"
      },
      "featureLevel": "2.2.x",
      "featureSummary": "完整便携存储 2.2.x",
      "maintenanceLevel": "active",
      "tests": {
        "clientGameTest": true,
        "serverIntegration": true,
        "compatibilityProfiles": [
          { "id": "quickshulker", "property": "compat_quickshulker", "ci": true }
        ]
      },
      "release": {
        "status": "stable",
        "artifact": "BetterShulkerHud-2.2.3+mc26.1.1.jar",
        "sourcesArtifact": "BetterShulkerHud-2.2.3+mc26.1.1-sources.jar"
      }
    },
    {
      "id": "26.1.2",
      "path": "versions/26.1.2",
      "minecraft": { "build": "26.1.2", "range": "26.1.2" },
      "modVersion": "2.0.6",
      "java": 25,
      "gradle": "9.5.1",
      "loom": "1.16.3",
      "loader": { "build": "0.19.2", "requirement": ">=0.18.4" },
      "fabricApi": "0.155.2+26.1.2",
      "malilib": "fi.dy.masa.malilib:malilib-fabric-26.1.2:0.28.9",
      "optionalCompatibility": {
        "quickShulker": "3.0.1-26.1",
        "rei": "26.1.819",
        "jei": "29.21.0.66"
      },
      "featureLevel": "2.0.x",
      "featureSummary": "稳定 2.0.x",
      "maintenanceLevel": "maintenance",
      "tests": {
        "clientGameTest": true,
        "serverIntegration": false,
        "compatibilityProfiles": [
          { "id": "quickshulker", "property": "compat_quickshulker", "ci": true }
        ]
      },
      "release": {
        "status": "stable",
        "artifact": "BetterShulkerHud-2.0.6+mc26.1.2.jar",
        "sourcesArtifact": "BetterShulkerHud-2.0.6+mc26.1.2-sources.jar"
      }
    },
    {
      "id": "26.2",
      "path": "versions/26.2",
      "minecraft": { "build": "26.2", "range": ">=26.2 <26.3" },
      "modVersion": "2.2.3",
      "java": 25,
      "gradle": "9.5.1",
      "loom": "1.16.3",
      "loader": { "build": "0.19.3", "requirement": ">=0.19.3" },
      "fabricApi": "0.156.0+26.2",
      "malilib": "fi.dy.masa.malilib:malilib-fabric-26.2:0.29.2",
      "optionalCompatibility": {
        "quickShulker": "3.0.2-26.2",
        "rei": "26.2.821",
        "jei": "30.15.0.118",
        "itemScroller": "0.32.1"
      },
      "featureLevel": "2.2.x",
      "featureSummary": "完整便携存储 2.2.x",
      "maintenanceLevel": "active",
      "tests": {
        "clientGameTest": true,
        "serverIntegration": true,
        "compatibilityProfiles": [
          { "id": "quickshulker", "property": "compat_quickshulker", "ci": true },
          { "id": "itemscroller", "property": "itemscroller_test_jar", "ci": false, "requiresLocalArtifact": true }
        ]
      },
      "release": {
        "status": "stable",
        "artifact": "BetterShulkerHud-2.2.3+mc26.2.x.jar",
        "sourcesArtifact": "BetterShulkerHud-2.2.3+mc26.2.x-sources.jar"
      }
    }
  ]
}
